{
  "platform": "android",
  "execution_target": "local",
  "appium_server_url": "http://127.0.0.1:4723",
  "device_name": "emulator-5554",
  "avd": "Pixel_8_API_34",
  "platform_version": "14",
  "automation_name": "UiAutomator2",
  "app_package": "com.everi.loyalty.kiosk",
  "app_activity": "com.everi.loyalty.kiosk.MainActivity",
  "bundle_id": null,
  "app_path": null,
  "app_version": null,
  "browserstack": {
    "username": null,
    "access_key": null,
    "hub_url": "https://hub-cloud.browserstack.com/wd/hub",
    "app_id": null,
    "device": "Google Pixel 8",
    "os_version": "14",
    "project_name": "Loyalty Kiosk",
    "build_name": "loyalty-mobile-regression"
  },
  "app_username": null,
  "app_password": null,
  "app_auth_strategy": "env-var",
  "test_output_path": "mobile-tests",
  "report_output_path": "results",
  "screenshot_mode": "on-failure",
  "log_level": "step",
  "robot_project_mode": "new",
  "robot_config_path": null,
  "input_source": "ado",
  "raw_input_file": null,
  "user_story_ado_link": "https://dev.azure.com/everi/Loyalty%20Kiosk/_workitems/edit/1326051",
  "user_story_id": 1326051,
  "test_cases_ado_link": "https://dev.azure.com/everi/Loyalty%20Kiosk/_testPlans/execute?planId=432931&suiteId=1329228",
  "test_plan_id": 432931,
  "test_suite_id": 1329228,
  "reviewer_ado_user_id": "ado-user-id",
  "target_repo": "your-ado-repo-name",
  "target_branch": "main",
  "target_local_path": null,
  "spec_name_override": null,
  "target_screens": [],
  "run_mode": "dry-run",
  "execution_confirmation": null,
  "allow_ado_mutation": false,
  "allow_probe_resources": false,
  "ado_access_mode": "read-only",
  "ado_tool_calls_mode": "read-wrapper-only",
  "ado_write_tools_disabled": true,
  "ado_pat": null,
  "ado_org": "everi",
  "ado_project": "Loyalty Kiosk",
  "self_healing": {
    "enabled": false,
    "heal_task": "heal-failures",
    "app_version": null,
    "previous_app_version": null,
    "heal_mode": "report-driven",
    "results_report_path": "results/output.xml",
    "max_attempts_per_locator": 3,
    "max_total_reruns": 5,
    "heal_shared_locators": true,
    "strategy": "accessibility-first"
  }
}
